A_id,B_id,risk,reason
9184112614,9184112615,0.25,"Мероприятие A и Мероприятие B связаны косвенно через общую цель улучшения инфраструктуры в сфере ИТ, однако непосредственная зависимость между ними отсутствует. Мероприятие A фокусируется на образовании и подготовке кадров для ИТ-компаний, тогда как Мероприятие B направлено на создание платформы противодействия мошенничеству в сфере ИКТ. Влияние каждого мероприятия на другое минимально, поскольку они адресуют разные аспекты: образование и безопасность информации. Таким образом, риск негативного влияния одного мероприятия на другое оценивается как умеренный (time_level = 2, resource_level = 1), что дает общий риск 3 и вероятность неудачи 0.25."
9184112614,9184112616,0.25,"Мероприятие A влияет на кадровое и образовательное развитие, требует координации между учебными организациями и ИТ-компаниями, что может привести к незначительным задержкам (time_level=1) и умеренному влиянию на ресурсы (resource_level=2), общий риск = 3/12 = 0.25. Мероприятие B, связанное с мониторингом интернет-ресурсов, не имеет четко определенных ресурсов и сроков, что означает отсутствие непосредственного влияния (time_level=0, resource_level=0) и нулевой риск. Однако, поскольку задача связана с анализом мероприятий A и B, общая оценка риска учитывает влияние только мероприятия A."
9184112614,9184112617,0.25,"Мероприятие A оказывает значительное влияние на ресурсы, так как требует координации между образовательными организациями и ИТ-компаниями для обеспечения соответствия компетенций студентов требованиям рынка, что может привести к увеличению временных затрат при внедрении изменений в нормативные акты. В то же время, мероприятие B фокусируется на оценке защищенности ГИС и не требует значительного ресурсного вклада или временных затрат для своей реализации. Общая вероятность негативного исхода, учитывая суммарное влияние на ресурсы (3) и минимальное влияние на сроки (1), составляет 4/12 ≈ 0.25."
9184112614,9184112624,0.25,"Мероприятие A и Мероприятие B имеют относительно низкий уровень влияния на сроки и ресурсы, так как оба мероприятия не содержат конкретных временных рамок или специфических ресурсов. Однако Мероприятие A включает изменения нормативно-правовых актов, что может потенциально замедлить процесс из-за необходимости согласования и адаптации, в то время как Мероприятие B ориентировано на создание инфраструктуры безопасного ПО, что требует значительных ресурсов для разработки облачной платформы и унифицированных инструментов. В целом, связь между мероприятиями ограничена, поскольку Мероприятие A сосредоточено на образовательном аспекте и взаимодействии ИТ-компаний с высшими учебными заведениями, тогда как Мероприятие B направлено на разработку инструментальной платформы для безопасного ПО. Это приводит к низкому общему риску (total_risk = 1+2=3, probability_failure = 3/12 = 0.25) с косвенным влиянием."
9184112614,9184112626,0.4166666666666667,"Связь между мероприятием A и B основана на общей цифровизации и внедрении технологий, где успех реализации практико-ориентированных программ по ИТ способствует развитию кадров для поддержки функционирования цифровых платформ. Однако у мероприятия A отсутствуют конкретные сроки и региональная привязка, что может ограничить непосредственное влияние на платформы B. В то же время оба мероприятия направлены на повышение эффективности государственного управления и цифровизацию, что создает косвенную зависимость: успешное внедрение практико-ориентированных программ может обеспечить необходимый поток квалифицированных специалистов для поддержки и развития цифровых платформ. Влияние на сроки (time_level = 2) и ресурсы (resource_level = 2) приводит к общему риску total_risk = 4, что соответствует вероятности негативного исхода probability_failure ≈ 0.33. Однако учитывая дополнительные факторы взаимодействия между образовательными и государственными цифровыми проектами, вероятность негативного исхода оценивается как 0.42."
9184112614,9184112627,0.0833333333333333,"Мероприятие A и Мероприятие B связаны через общую цель улучшения качества образования, однако влияние на сроки и ресурсы оценивается как низкое (time_level=0, resource_level=1), что приводит к общему риску 1/12 ≈ 0.0833. Связь между ними косвенная: изменения в нормативных актах и практико-ориентированные программы (A) подготавливают почву для успешного внедрения цифровых образовательных сервисов (B), но не требуют одновременной реализации критических компонентов."
9184112614,9184112628,0.25,"Мероприятие A влияет на образовательные программы и нормативно-правовые акты, что может оказывать умеренное влияние на сроки (time_level=2) и ресурсы (resource_level=1), тогда как Мероприятие B связано с поставкой оборудования и программного обеспечения, что также может привести к умеренному влиянию на сроки (time_level=2) и ресурсы (resource_level=1). Общий риск для каждого мероприятия составляет 3 (2+1), вероятность негативного исхода равна 3/12 = 0.25, при этом зависимость оказывается косвенной, так как ни одно из мероприятий не имеет критического уровня влияния (4)."
9184112614,9184134191,0.0833333333333333,"Мероприятие A и Мероприятие B имеют слабую взаимосвязь, поскольку они относятся к различным сферам деятельности (образование ИТ и контрольные системы). Влияние на сроки и ресурсы для каждого мероприятия незначительное, что приводит к общему низкому уровню риска."
9184112614,9184134192,0.25,"Мероприятие A ориентировано на практическое обучение студентов в ИТ-специальностях через сотрудничество с аккредитованными компаниями, что требует координации между образовательными организациями и частным сектором. Влияние на сроки (time_level) можно оценить как 2 (умеренное), а влияние на ресурсы (resource_level) — также 2, что дает общий риск 4/12 = 0.33. Однако, поскольку мероприятие B фокусируется на оптимизации госуслуг и включает более широкий набор задач с длительным временным периодом (2025-2030) и значительными ресурсами, его оценка может быть выше. Но поскольку запрос требует анализ связанности между двумя мероприятиями, можно считать, что взаимозависимость невысока: Мероприятие A касается образования и подготовки специалистов, тогда как Мероприятие B связано с оптимизацией госуслуг. Несмотря на то что успешное обучение в ИТ-специальностях может косвенно поддерживать разработку информационных систем для госуслуг, прямая зависимость отсутствует. Поэтому можно оценить общую вероятность негативного исхода как 0.25."
9184112614,9184156545,0.25,"Мероприятие A и Мероприятие B связаны через общую цель улучшения квалификации ИТ-специалистов и взаимодействия между государством, образовательными организациями и ИТ-компаниями. В Мероприятии A акцент сделан на практико-ориентированное обучение через взаимодействие высших учебных заведений и ИТ-компаний, что напрямую поддерживает развитие кадровых ресурсов. В Мероприятии B создается национальная система подтверждения компетенций, которая помогает стандартизировать и подтвердить уровень ИТ-компетенций, что дополнительно способствует качеству обучения. Несмотря на различия в региональной привязке (Мероприятие A не имеет конкретного региона, а Мероприятие B ограничено РФ) и в распределении ресурсов (в Мероприятии A задействованы образовательные организации и ИТ-компании, тогда как Мероприятие B использует государственную поддержку), существует косвенная связь через улучшение качества образования и профессиональной подготовки ИТ-специалистов. Оценка влияния: time_level = 1 (незначительное), resource_level = 2 (умеренное) для Мероприятия A, total_risk = 3/12 = 0.25; impact_type = косвенное."
