A_id,B_id,risk,reason
0,1,0.0,"Мероприятие А не связано с обеспечением доверенности и безопасности обмена, а мероприятие Б не требует реализации криптографических компонентов для своей реализации."
0,2,0.0,"Мероприятие А связано с образовательными программами в сфере ИТ, а мероприятие Б - с выявлением фишинговых ресурсов и утечек данных. Нет прямой зависимости между ними. Отмена А не повлияет на реализацию Б."
0,3,0.0,"Мероприятие А связано с образовательными программами в сфере ИТ, а мероприятие Б касается оценки защищенности ГИС. Нет прямой зависимости между ними. Отмена мероприятия А не повлияет на реализацию мероприятия Б."
0,4,0.0,"В описании графа мероприятий и входных данных не указаны конкретные мероприятия А и Б, поэтому невозможно определить их взаимосвязь и оценить риски отмены мероприятия А для реализации мероприятия Б."
0,5,0.0,"В описании графа мероприятий не упоминается мероприятие А, указанное в запросе (практико-ориентированное обучение ИТ). Не удается определить прямую зависимость между этим мероприятием и реализацией платформ, описанных в мероприятии Б. На основании имеющейся информации невозможно оценить риски отмены мероприятия А для реализации мероприятия Б."
0,6,0.0,"В описании графа мероприятий и входных данных не упоминается мероприятие А, и нет прямой ссылки на мероприятие А в описании мероприятия Б. Не хватает информации для анализа взаимосвязи между мероприятиями А и Б."
0,7,0.0,Отсутствие информации о мероприятии А в графе зависимостей
0,8,0.0,"Мероприятие А связано с образовательными программами в сфере ИТ и не имеет прямой зависимости от мероприятий, связанных с криптографией или безопасностью. Мероприятие Б - это информационная система, которая, как указано в описании, взаимодействует с несколькими внешними системами. Однако в описании мероприятия Б не упоминается необходимость криптографических компонентов для её реализации. Таким образом, отмена мероприятия А не повлияет на реализацию мероприятия Б."
0,9,0.0,"Мероприятие А связано с образовательными программами для ИТ-специальностей, а мероприятие Б - с оптимизацией госуслуг. Нет прямой зависимости между ними, особенно в контексте криптографических компонентов. Риск срыва реализации мероприятия Б из-за отмены мероприятия А низкий."
0,10,0.0,"Входные данные не содержат информации о мероприятии А в графе зависимостей, поэтому невозможно определить его роль в обеспечении доверенности и безопасности обмена. Также отсутствует информация о криптографических компонентах в описании мероприятия Б. Без этой информации невозможно оценить риски срыва или снижения качества реализации платформы."
