A_id,B_id,risk,reason
9184112614,9184277910,0.5,"Исходное мероприятие: Формирование компетенций студентов ИТ-специальностей через партнерские программы с ИТ-компаниями, сопровождающееся нормативными изменениями.
Наиболее связанное мероприятие: Реализация проектов по разработке/внедрению российских IT-решений с участием компаний и госструктур.
Объяснение зависимости: Отказ от реализации второго мероприятия (прекращение финансирования, срыв проектов) приведёт к потере практических навыков студентов (временные последствия: сдвиг сроков завершения образовательных программ, снижение качества подготовки). Утрата государственной и корпоративной поддержки (ресурсные последствия: дефицит финансовых, человеческих и инфраструктурных ресурсов) нарушила бы механизм взаимодействия между образовательными организациями и бизнесом, что парализует достижение целей исходного мероприятия."
9184112614,9184277911,0.5,"Исходное мероприятие: Образовательная программа, направленная на формирование компетенций студентов ИТ-специальностей при участии компаний, сопряжённая с налоговыми льготами для таких фирм.
Наиболее связанное мероприятие: Программа акселерации проектов ИТ-решений фондом развития интернет-инициатив, обеспечивающая развитие профессиональных компетенций и снижение рисков для стартапов.
Объяснение зависимости: Успешность акселерации напрямую влияет на качество подготовки студентов, так как её результаты (профессиональные компетенции, инвестиционная привлекательность) становятся основой для эффективного взаимодействия с компаниями. Если акселерация провалится, это снизит уровень готовности выпускников, что подпортит выполнение требований закона о налоговых льготах для компаний, участвующих в образовании. Также возможны задержки в внедрении новых учебных программ из-за недостатка реальных примеров успешных проектов."
9184112614,9184277912,0.67,"Исходное мероприятие: Образование IT-специалистов через партнерство с компаниями, обеспечивающее соответствие компетенций требованиям рынка. Наибольшая зависимость отдельный вид деятельности. Название: ..."
9184112614,9184277913,0.333,"Исходное мероприятие: Образовательная программа, направленная на формирование компетенций студентов через сотрудничество с ИТ-компаниями.
Наиболее связанное мероприятие: Формирование списка проектов для дорожной карты разработки ПО.
Объяснение зависимости: Успешное выполнение второго события обеспечивает наличие реальных проектов, которые могут быть интегрированы в учебный процесс первого мероприятия. Если второй проект будет нарушен (например, задержан или отменён), это может привести к снижению эффективности программы повышения квалификации студентов за счёт недостатка практических заданий и несоответствия требований рынка. Однако зависимость является косвенной, так как первый этап зависит больше от стабильности партнёрских отношений, чем отдельно от времени."
9184112614,9184435239,0.1667,"Исходное мероприятие: Программы подготовки IT-специалистов через партнерство с компаниями.
Наиболее связанное мероприятие: Разработка цифровой платформы для управления данными о защите прав граждан.
Объяснение зависимости: Связь между мероприятиями минимальна. Первое мероприятие ориентировано на образовательные процессы и формирование квалифицированных кадров, а второе — на создание технической инфраструктуры для административных задач. Отмена первого мероприятия не直接影响 the implementation of the second, так как потребность в IT-специалистах не является критическим фактором для функционирования цифровой платформы. Однако косвенная связь существует: успешное завершение первого мероприятия могло бы повысить качество персонала, работающего с системой, но это не является обязательным условием. Таким образом, влияние на сроки и ресурсы практически отсутствует."
9184112614,9184435252,0.5,"Исходное мероприятие: ... Наиболее связанное мероприятие: ... Объяснение зависимости: Программы образовательных организаций и ИТ-компаний зависят от государственной политики поддержки инноваций. Отказ от проведения конкурсов грантов для малых предприятий (включая ИИ-проекты) снижает доступность финансирования для компаний, участвующих в образовательном процессе. Это может привести к замедлению внедрения новых технологий в учебный процесс, потере мотивации компаний к сотрудничеству и увеличению нагрузки на образовательные организации при адаптации программ. Умеренное влияние на сроки (задержка реализации проектов) и ресурсы (неполучение средств для разработки компетенций студентов)."
9184112614,9184435253,0.167,"Исходное мероприятие: Образовательные программы по ИТ-специальностям с участием ИТ-компаний.
Наиболее связанное мероприятие: Создание цифровой платформы АИС Ростехнадзора.
Объяснение зависимости: Оба мероприятия связаны с цифровизацией и технологическим развитием, однако прямая зависимость отсутствует. Отказ от создания цифровой платформы Ростехнадзора может косвенно повлиять на развитие технологических стандартов, но не вызовет критического воздействия на образовательную деятельность. Уровень влияния на сроки и ресурсы незначителен."
9184112614,9184435254,0.4166666666666667,"Исходное мероприятие: Образовательная программа для подготовки IT-специалистов через сотрудничество с компаниями.
Наиболее связанное мероприятие: Разработка государственных информационных систем на платформе ""ГосТех"".
Объяснение зависимости: Успешное выполнение второго мероприятия требует наличия квалифицированных кадров, формируемых первым мероприятием. Если второй проект будет нарушен (например, из-за недостатка специалистов), это приведёт к снижению эффективности первого мероприятия: потеря партнёрских связей с компаниями, невозможность актуализировать программы под потребности рынка. Наоборот, проблемы в первом мероприятии могут замедлить подготовку персонала для работы с ""ГосТех"", что повлияет на реализацию второго."
9184112614,9184509753,0.0833,"Исходное мероприятие: Формирование квалифицированных кадров в сфере ИТ через партнерство образовательных учреждений и компаний.
Наиболее связанное мероприятие: Разработка квантовых вычислителей и алгоритмов в рамках государственной программы ""Высокотехнологичная область"".
Объяснение зависимости: Прямой связи между образованием IT-специалистов и разработкой квантовых систем нет. Однако косвенная зависимость возможна только при условии, что кадры из первого мероприятия могут участвовать в реализации второго. Поскольку сбой во втором мероприятии не повлияет на структуру образовательных программ и обратно, влияние на сроки (time_level=1) и ресурсы (resource_level=1) минимально. Total risk = 2 → probability_failure = 2/12 ≈ 0.167."
9184112614,9184512793,0.67,"Исходное мероприятие: Формирование квалифицированных IT-специалистов через партнерство образовательных учреждений и IT-компаний.
Наиболее связанное мероприятие: Создание Единой цифровой платформы МИД России.
Объяснение зависимости: Успешная реализация платформы требует наличия квалифицированных IT-специалистов, которых готовят программы исходного мероприятия. Сбой в образовательном процессе (например, недостаток кадров или отсутствие законодательной базы для льгот) приведет к задержкам в запуске/функционировании платформы. Критический дефицит специалистов или отказ от законодательных преференций сделает реализацию платформы невозможно."
9184112614,9184512798,0.5,"Исходное мероприятие: Формирование практико-ориентированного образования ИТ-специалистов через сотрудничество с компаниями, требующее стандартизации процессов и инфраструктуры.
Наиболее связанное мероприятие: Создание единой платформы для данных, обеспечивающей interoperability между государством, бизнесом и разработчиками ИИ-решений.
Объяснение зависимости: Успешная реализация первого мероприятия зависит от наличия унифицированной инфраструктуры (платформы), которая позволяет эффективно координировать учебные процессы, передавать данные и обеспечивать соответствие компетенций требованиям компаний. Отказ от создания платформы приведёт к увеличению сложности внедрения программы, потере синхронизации действий сторон и возможному снижению качества подготовки специалистов."
9184112614,9184512799,0.5,"Исходное мероприятие: Формирование кадрового потенциала в области IT через образовательные программы с участием IT-компаний.
Наиболее связанное мероприятие: Разработка подсистемы базовых станций 5G с использованием российских компонентов.
Объяснение зависимости: Успешность второго мероприятия напрямую зависит от наличия квалифицированных специалистов, воспитываемых первым мероприятием. Отказ IT-компаний от участия в образовательных программах (из-за сбоя в втором мероприятии) может парализовать подготовку кадров, необходимых для эксплуатации 5G-сетей. Одновременно изменения в законодательстве, оговоренные первым мероприятием, регулируют условия участия компаний в инновационных проектах, включая второй."
9184112614,9184512800,0.17,"Исходное мероприятие: Образовательная программа для ИТ-специалистов с привлечением компаний.
Наиболее связанное мероприятие: Разработка оборудования для сетей 4G/5G с OpenRAN.
Объяснение зависимости: Прямая зависимость минимальна, но возможны косвенные эффекты. Если производство оборудования (связанное мероприятие) задерживается, это может повлиять на доступность инфраструктуры для практических занятий в образовательном процессе (исходное мероприятие). Однако регламентированная система требует наличия конкретного текстового формата, поэтому при наличии явных данных о том, какие именно данные были использованы, можно использовать следующие шаги: ..."
9184112614,9184641868,0.5,"Исходное мероприятие: Программа подготовки IT-специалистов через сотрудничество университетов и компаний.
Наиболее связанное мероприятие: Дополнительная программа для школьников и СПО по STEM-направлениям.
Объяснение зависимости: Отказ от программы для молодёжи может привести к снижению числа квалифицированных специалистов, способных удовлетворять потребности рынка труда. Это мероприятие связано с формированием основ знаний в области информационных технологий, необходимых для дальнейшей подготовки специалистов. Если это мероприятие будет приостановлено, то возникнет дефицит кадров, что повлияет на эффективность работы образовательных программ и партнёрства с компаниями."
9184112614,9184828244,0.5833,"Исходное мероприятие: Формирование системы практико-ориентированного обучения ИТ-специальностей через сотрудничество с компаниями.
Наиболее связанное мероприятие: Разработка и масштабирование образовательных программ для топ-специалистов с учетом компетенций рынка.
Объяснение зависимости: Отмена/изменение исходного мероприятия нарушило базовый механизм взаимодействия образовательных учреждений с ИТ-компаниями, что напрямую затруднило формирование актуальных стандартов компетенций (time_level=3, resource_level=3). Утрата нормативной базы для льгот компаний ограничила возможности финансирования и ресурсной поддержки для развития программ второго мероприятия."
9184112614,9184828245,0.16666666666666666,"Исходное мероприятие: Образовательная программа по ИТ-специальностям с упором на практическую подготовку через сотрудничество с компаниями.
Наиболее связанное мероприятие: Программа подготовки топ-специалистов в сфере ИИ с участием работодателей и исследовательских центров.
Объяснение зависимости: Оба мероприятия предполагают участие бизнес-сообщества в образовании, но фокусируются на разных областях (ИТ vs. ИИ). Отказ одного не напрямую влияет на выполнение другого, так как они используют разные партнёры и целевые группы. Однако общая зависимость существует через систему профессионального развития и стандартов качества."
9184112614,9184828249,0.5,"Исходное мероприятие: ... Наиболее связанное мероприятие: ... Объяснение зависимости: Связь между мероприятиями минимальна. Исходное мероприятие регулирует сотрудничество образовательных организаций и IT-компаний, тогда как связанное мероприятие поддерживает финансовую активность конкретной компании ""Бюро 1440"". Отмена/задержка второго мероприятия может вызвать временные трудности в развитии спутниковой инфраструктуры, но не直接影响ет образовательную систему. Уровень влияния на сроки: 2 (умеренное), на ресурсы: 2 (умеренное). Total risk: 4 → probability_failure = 4/12 ≈ 0.33."
9184112614,9185078479,0.0,"Исходное мероприятие: Формирование системы практико-ориентированного IT-образования с участием компаний.
Наиболее связанное мероприятие: Космический запуск через закупку услуг у Минобороны России.
Объяснение зависимости: Мероприятия принадлежат полностью различным сферам (IT-образование vs. космическая деятельность). Не наблюдается прямых связей в целях, ресурсах, временных рамках или регуляторных механизмах. Отказ одного мероприятия не оказывает влияния на выполнение другого."
9184112614,9186186748,0.4167,"Исходное мероприятие: Программы подготовки IT-специалистов через сотрудничество образовательных организаций с ИТ-компаниями.
Наиболее связанное мероприятие: Цифровизация госуправления, автоматизация нормотворчества и систем управления данными.
Объяснение зависимости: Задержка/сбой в реализации второго мероприятия (например, при создании ФГИС ТП или автоматизации нормотворчества) может повлиять на сроки принятия нормативных актов, необходимых для участия ИТ-компаний в образовании (первое мероприятие). Отсутствие унифицированных ИТ-платформ (ФГИС ТП, ЕЦП ГосТех) усложняет координацию между образовательными организациями и бизнесом, увеличивая временные и ресурсные затраты."
