A_id,B_id,risk,reason
9184112614,9184112615,0.5,"Исходное мероприятие: Образовательные программы для ИТ-специалистов, требующие сотрудничества с ИТ-компаниями.
Наиболее связанное мероприятие: Связь с мероприятием ""..."""
9184112614,9184112616,0.25,"Исходное мероприятие: Формирование квалифицированных IT-специалистов через партнерство образовательных учреждений и компаний.
Наиболее связанное мероприятие: Борьба с интернет-мошенничеством и защита данных.
Объяснение зависимости: Отсутствие эффективного мониторинга утечек данных (связное мероприятие) может повысить риски для информации студентов и инфраструктуры, используемой в рамках первого мероприятия. Однако прямая зависимость слабая: первое мероприятие ориентировано на образование, а второе — на безопасность. Сбой второго мероприятия может вызвать дополнительные затраты на обеспечение безопасности в первом, но без критического воздействия на сроки или основные ресурсы."
9184112614,9184112617,0.3333333333333333,"Исходное мероприятие: Подготовка IT-специалистов через партнерство с ИТ-компаниями, включая нормативные изменения для предоставления льгот.
Наиболее связанное мероприятие: Оценка безопасности ГИС с участием ФСБ и ФСТЭК.
Объяснение зависимости: "
9184112614,9184112624,0.75,"Исходное мероприятие: Формирование кадрового потенциала в области ИТ через партнерство образовательных учреждений и компаний.
Наиболее связанное мероприятие: Разработка универсальной среды безопасной разработки ПО.
Объяснение зависимости: Отказ от создания унифицированной среды (второе мероприятие) лишает студентов (первое мероприятие) практических навыков работы с современными инструментами безопасности. Без развитых инструментов (например, статического анализа кода, фаззинг-тестирования) невозможно достичь требуемых стандартов качества, установленных законодательством. Это парализует процесс подготовки специалистов и делает невозможным предоставление льгот компаниям, участвующим в обучении."
9184112614,9184112626,0.17,"Исходное мероприятие: Образовательные программы ИТ-специальностей с участием компаний.
Наиболее связанное мероприятие: Разработка цифровых платформ ""Университеты"", ""Наука"" и других.
Объяснение зависимости: Прямая зависимость минимальна. Хотя платформа ""Университеты"" может частично автоматизировать процессы управления образованием, она не напрямую связана с конкретными требованиями к ИТ-специальностям или обязательным участием компаний в обучении. Отказ от создания таких платформ не скажется на основных ресурсах (IT-компании, образовательные программы) и временных рамках исходного мероприятия."
9184112614,9184112627,0.3333333333333333,"Исходное мероприятие: Образовательная программа для ИТ-специалистов с привлечением компаний.
Наиболее связанное мероприятие: Платформа для доступа к цифровым образовательным ресурсам.
Объяснение зависимости: Успешность программы требует цифровой инфраструктуры (платформы), которая обеспечивает практическую часть обучения через технологии. Если платформа не работает (задержка, отказ), это повлияет на внедрение программы: сроки будут затянуты из-за недоступности необходимых инструментов, а ресурсы (время, техническая поддержка) придется перераспределять для компенсации дефицита."
9184112614,9184112628,0.25,"Исходное мероприятие: Формирование практико-ориентированного IT-образования с участием компаний для предоставления льгот.
Наиболее связанное мероприятие: Поставка планшетов с отечественной ОС для школьных педагогов.
Объяснение зависимости: Отсутствие успешного формирования IT-компетенций студентов (первое мероприятие) может создать дефицит квалифицированных кадров, необходимых для внедрения цифровых инноваций в образование (второе мероприятие). Однако прямая причинно-следственная связь ограничена: успех второго мероприятия зависит более напрямую от наличия технической базы и государственной политики, чем от уровня IT-подготовки студентов."
9184112614,9184134191,0.167,"Исходное мероприятие: ... Наиболее связанное мероприятие: ... Объяснение зависимости: Непрямая слабая зависимость через общую тему регулирования и внедрения требований законодательства. Однако конкретная функциональная связь отсутствует: первое мероприятие фокусируется на образовании и сотрудничестве с ИТ-компаниями, второе — на административном контроле и автоматизации процессов. Сбой второго мероприятия может повлиять на оперативность проверок соблюдения новых нормативных актов первого события только при наличии явной интеграции систем, которая не указанна в текстах."
9184112614,9184134192,0.25,"Исходное мероприятие: Обучение IT-специалистов через партнерство образовательных учреждений и компаний.
Наиболее связанное мероприятие: Оптимизация государственных услуг и цифровая трансформация через фонд ""Центр стратегических разработок"".
Объяснение зависимости: Прямая связь отсутствует, однако косвенная зависимость существует через интеграцию цифровых инфраструктур (например, системы ""Мои документы"") и нормативные акты. Задержки в внедрении государственных сервисов могут повлиять на доступность ресурсов для образовательных программ (например, сертификационные процедуры). Умеренное влияние на сроки (2) и минимальное влияние на ресурсы (1), поскольку основные ресурсы остаются автономными."
9184112614,9184156545,0.5833333333,"Исходное мероприятие: ... Образование ИТ-специальностей через партнерские программы с компаниями, требующие участие компаний в обучении для получения льгот.
Связное мероприятие: ... Национальная система подтверждения компетенций, обеспечивающая легализацию проверки навыков и снижение времени заполнения вакансий.
Объяснение зависимости: Событие 'связное' может быть вызвано тем, что если не будет возможности использовать эти данные, то это приведёт к тому, что все они будут использоваться вместе. Если первое мероприятие не выполнится из-за проблем с реализацией второго, это повлечёт за собой недостаточную мотивацию компаний участвовать в образовательных программах, так как им не хватает эффективного механизма проверки компетенций. Это создаст цепочку зависимостей, где успешность первого напрямую зависит от функционирования второй системы."
9184112614,9184156547,0.5,"Исходное мероприятие: Формирование IT-персонала через практико-ориентированное образование с участием IT-компаний.
Наиболее связанное мероприятие: Финансирование ИТ-инфраструктуры в образовательных организациях через субсидии.
Объяснение зависимости: Успешная реализация исходного мероприятия требует наличия современной ИТ-инфраструктуры (Wi-Fi сети), обеспечивающей практическую деятельность студентов и взаимодействие с компаниями. Отказ от субсидий (или сбой в её предоставлении) приведёт к невозможности создания необходимых условий для обучения, что парализует развитие IT-кадров. Одновременно, задержка в освоении инфраструктуры увеличит сроки достижения целей программы по подготовке специалистов."
9184112614,9184156548,0.1667,"Исходное мероприятие: Формирование IT-специалистов через образовательные программы с участием IT-компаний.
Наиболее связанное мероприятие: Разработка HR-платформы и модернизация Единой информационной системы управления кадрами.
Объяснение зависимости: Прямая связь минимальна, так как первое мероприятие формирует кадры, которые могут быть нужны для внедрения HR-систем во втором мероприятии. Однако отмена первого события не гарантирует прямого воздействия на сроки или ресурсы второго, поскольку второе мероприятие сосредоточено на технической инфраструктуре и государственных процедурах, а не на подготовке персонала. Зависимость косвенная и ограниченная."
9184112614,9184156549,0.5,"Исходное мероприятие: Подготовка IT-специалистов через партнерство образовательных учреждений и ИТ-компаний.
Наиболее связанное мероприятие: Разработка облачной инфраструктуры для государственных систем.
Объяснение зависимости: Успешное функционирование первого мероприятия требует наличия квалифицированных специалистов, способных эксплуатировать и развивать технологии, описываемые во втором мероприятии. Отсрочка или изменение второго события (например, недоступность необходимых инфраструктурных решений) может снизить ценность практических компетенций студентов, обучаемых по практико-ориентированным программам. Одновременно, дефицит опытных специалистов (из-за возможного сбоя в образовательном процессе) может замедлить внедрение новой облачной инфраструктуры."
9184112614,9184156550,0.5,"Исходное мероприятие: Образовательная программа, направленная на формирование компетенций студентов ИТ-специальностей через сотрудничество с компаниями, требующая инфраструктуры для цифровизации процессов.
Наиболее связанное мероприятие: Разработка коммуникационных сервисов и унифицированного информационного пространства для электронного документооборота.
Объяснение зависимости: Успешность программы зависит от наличия современной инфраструктуры (типовых сервисов и информационного пространства), обеспечивающей эффективную работу ИТ-компаний. Задержка или отказ в реализации второго мероприятия приведёт к недоступности необходимых технологических решений, что ограничит возможности компаний для участия в образовательном процессе, снижает качество подготовки студентов и увеличивает затраты на поддержку устаревших систем."
9184112614,9184257564,0.75,"Исходное мероприятие: Подготовка IT-специалистов через практико-ориентированные программы с участием ИТ-компаний.
Наиболее связанное мероприятие: Разработка методов информационно-безопасной обработки данных с использованием криптографических механизмов.
Объяснение зависимости: Нарушение второй деятельности (задержка/отмена исследований)直接影响ает внедрение современных методов защиты данных в образовательные программы. Без развитых криптографических решений, разрабатываемых во втором мероприятии, невозможно достичь требуемого уровня компетенций студентов в области информационной безопасности. Это приведет к:
- Time_level=3 (значительное влияние на сроки реализации образовательных программ)
- Resource_level=4 (критическое влияние на ресурсы: потеря льгот для ИТ-компаний, невозможность адаптации программ под новые стандарты)"
9184112614,9184257565,0.5,"Исходное мероприятие: Формирование кадрового потенциала в области ИТ через практико-ориентированное образование с участием ИТ-компаний, включая регулирование льгот для компаний.
Наиболее связанное мероприятие: Реализация модернизации автоматизированной системы обеспечения безопасности интернета (АСБИ).
Объяснение зависимости: Успешная модернизация АСБИ требует наличия квалифицированных специалистов (IT-компетенций), воспитываемых в рамках первого мероприятия. Отмена или задержка первого мероприятия приведёт к дефициту кадров, что затруднит внедрение новых технических решений. Кроме того, изменения в законодательстве (первый этап) создаю благоприятную среду для инвестиций в защиту интернета (второй этап). Без достижения целей первого мероприятия снижается мотивация ИТ-компаний участвовать в проектах типа АСБИ."
9184112614,9184257566,0.5,"Исходное мероприятие: Формирование кадрового потенциала в области IT через партнерство образовательных учреждений и ИТ-компаний.
Наиболее связанное мероприятие: Создание инфраструктуры мониторинга информационной безопасности для госучреждений и стратегических предприятий.
Объяснение зависимости: Отмена исходного мероприятия может привести к снижению числа квалифицированных специалистов, способных разрабатывать и обслуживать сложную IT-инфраструктуру, описанную в связном мероприятии. Это создает риск недостатка кадров для эффективной реализации программы мониторинга безопасности, особенно в долгосрочной перспективе. Умеренное влияние на сроки (задержки в формировании команд) и ресурсы (нехватка специалистов)."
9184112614,9184277899,0.16666666666666666,"Исходное мероприятие: Программа подготовки IT-специалистов через партнерство университетов и IT-компаний с регуляторными изменениями.
Наиболее связанное мероприятие: Проект создания космической группировки ""Бюро 1440"".
Объяснение зависимости: Непрямая слабая зависимость возможна только при условии, что ""Бюро 1440"" является IT-компанией, участвующей в образовательных программах. Однако описание не указывает прямую связь между космическими технологиями и IT-образованием. Отказ от проекта может повлиять на ресурсную базу IT-компаний (например, если они используют спутники для инфраструктуры), но это предположение без конкретных данных. Уровень влияния на сроки и ресурсы минимальный из-за отсутствия явной интерконнективности."
9184112614,9184277908,0.333,"Исходное мероприятие: Формирование квалифицированных IT-специалистов через партнерство образовательных организаций и IT-компаний.
Наиболее связанное мероприятие: Тестирование ПО и аттестация центров тестирования.
Объяснение зависимости: Отмена мероприятия по тестированию ПО может повлечь за собой снижение качества подготовки IT-специалистов, поскольку предприятия, участвующие в образовании, зависят от надежного тестирования своих продуктов. Без эффективного тестирования ПО, обеспечивающего совместимость с российскими ОС, образовательные программы теряют актуальность, а ресOURCES (ресурсов) могут быть потери в объеме. Также возможны последствия для целей, таких как развитие цифровой экономики, инициаторы, и других факторов."
9184112614,9184277909,0.3333333333333333,"Исходное мероприятие: ... Наиболее связанное мероприятие: ... Объяснение зависимости: Связность мероприятий определяется зависимостью между регуляторными рамками и практической реализацией. Исходное мероприятие требует участия ИТ-компаний в образовательных программах для получения налоговых льгот, тогда как второе мероприятие (разработка ФГИС «Реестры ПО») напрямую связано с процедурой регистрации программного обеспечения, необходимой для получения преференций. Если система ФГИС будет недоступна или некорректно функционировать, это затруднит процесс сертификации ИТ-продуктов, что повлияет на возможность компаний получать льготы, зафиксированные в первом мероприятии. Таким образом, сбой во втором мероприятии создаст системный эффект, нарушая условия первого."
